[{"children":["asn_grounding","asn_determinism","asn_formal_checkability"],"claim":"Accepted CKC artifacts are source-grounded, deterministic, formally checkable, replayable, and suitable for identifying source text requiring review.","evidence_artifact_ids":[],"node_id":"asn_root","node_type":"goal","status":"supported"},{"children":[],"claim":"Source grounding holds under closed-world SHACL over CKC rules: every accepted rule carries source-span and provenance support.","evidence_artifact_ids":["sha256:592a9268b5f90588945f519758ed53fad2e1e3b712294dd8af85dddb9eb04f72"],"node_id":"asn_grounding","node_type":"strategy","status":"supported"},{"children":[],"claim":"Determinism and replay hold for every accepted artifact: each certificate records a passing replay status over content-addressed canonical bytes.","evidence_artifact_ids":["sha256:37aac2dbd4ecd2242ce8113a6559cc061c161efcbbdedcc9ce5b9693c3181700","sha256:57185d637009477b57d7e9155da1a2b6e64dacf5a17b31fed74210cce929abfb","sha256:592a9268b5f90588945f519758ed53fad2e1e3b712294dd8af85dddb9eb04f72","sha256:5af59ee961e53c28e00aac8d3a2f0067f52a9e9e5be29e6e4a941920fa6a6226","sha256:8527b09307b804f8d9bdeb71a25d8544f488fccb527cccabf33d24776425492d","sha256:a9fc6956f933f9fc3f2a937d652bdfe7a8eb04e9a2a3d6f02c6e2d45d828a172","sha256:b017ada0227620559bc998a0df7541019d94df7764745faa06dd9112aea76e7d","sha256:bd00b7426077c24924b6633e2a0c7c51a7ecbdf98e907efb3d9078a8326d8fd1","sha256:cb074f316e1796e2ca83a874a0a28cf3bb306c668af89856da384e470e800eff","sha256:f41e38c20b43c61b5558c49f7d7ed3ee289b7338663c6ec52354c94afd31c6c1","sha256:f7915e2269ee56e0eb1f871e7727a388b095f6bedbb31fab82c578a6d674ec28"],"node_id":"asn_determinism","node_type":"strategy","status":"supported"},{"children":[],"claim":"Formal checkability holds through independent solver and prover backends: SMT (z3, cvc5), ASP (clingo), Datalog (souffle), model checking (TLA+ SANY, Alloy), and a Lean kernel proof.","evidence_artifact_ids":["sha256:37aac2dbd4ecd2242ce8113a6559cc061c161efcbbdedcc9ce5b9693c3181700","sha256:57185d637009477b57d7e9155da1a2b6e64dacf5a17b31fed74210cce929abfb","sha256:5af59ee961e53c28e00aac8d3a2f0067f52a9e9e5be29e6e4a941920fa6a6226","sha256:8527b09307b804f8d9bdeb71a25d8544f488fccb527cccabf33d24776425492d","sha256:a9fc6956f933f9fc3f2a937d652bdfe7a8eb04e9a2a3d6f02c6e2d45d828a172","sha256:b017ada0227620559bc998a0df7541019d94df7764745faa06dd9112aea76e7d","sha256:bd00b7426077c24924b6633e2a0c7c51a7ecbdf98e907efb3d9078a8326d8fd1","sha256:cb074f316e1796e2ca83a874a0a28cf3bb306c668af89856da384e470e800eff","sha256:f41e38c20b43c61b5558c49f7d7ed3ee289b7338663c6ec52354c94afd31c6c1","sha256:f7915e2269ee56e0eb1f871e7727a388b095f6bedbb31fab82c578a6d674ec28"],"node_id":"asn_formal_checkability","node_type":"strategy","status":"supported"}]