[{"children":["strategy_formal_verification","strategy_source_grounding"],"claim":"Accepted CKC artifacts are source-grounded, deterministic, and formally checkable","evidence_artifact_ids":[],"node_id":"goal_ckc_top","node_type":"goal","status":"supported"},{"children":["solution_z3_witness"],"claim":"Demonstrate formal verification through multiple backend checkers","evidence_artifact_ids":[],"node_id":"strategy_formal_verification","node_type":"strategy","status":"supported"},{"children":["solution_span_coverage"],"claim":"Demonstrate source-span grounding for all clinical claims","evidence_artifact_ids":[],"node_id":"strategy_source_grounding","node_type":"strategy","status":"supported"},{"children":[],"claim":"Z3 SMT solver produces satisfying model for norm conflict witness","evidence_artifact_ids":["sha256:e001000000000000000000000000000000000000000000000000000000000001"],"node_id":"solution_z3_witness","node_type":"solution","status":"supported"},{"children":[],"claim":"All clinical claims reference existing, addressable source spans","evidence_artifact_ids":["sha256:e002000000000000000000000000000000000000000000000000000000000001"],"node_id":"solution_span_coverage","node_type":"solution","status":"supported"}]
