[{"children":["asn_grounding","asn_determinism","asn_formal_checkability"],"claim":"Accepted CKC artifacts are source-grounded, deterministic, formally checkable, replayable, and suitable for identifying source text requiring review.","evidence_artifact_ids":[],"node_id":"asn_root","node_type":"goal","status":"supported"},{"children":[],"claim":"Source grounding holds under closed-world SHACL over CKC rules: every accepted rule carries source-span and provenance support.","evidence_artifact_ids":["sha256:592a9268b5f90588945f519758ed53fad2e1e3b712294dd8af85dddb9eb04f72"],"node_id":"asn_grounding","node_type":"strategy","status":"supported"},{"children":[],"claim":"Determinism and replay hold for every accepted artifact: each certificate records a passing replay status over content-addressed canonical bytes.","evidence_artifact_ids":["sha256:194bd294be1058322c49e53309eaf17f56df2184f15503d9ac4150a7a8e0b7bb","sha256:3229752b8cb70aae5cf352dd2e666a902ae7fe5543c4366150b9c906323ed21a","sha256:4224e42851fe44127df938221d3b3ddb147b02e246962e5a7327a9c0a3e315f7","sha256:464892d106a2ec5b968a58260249fa08cddb03f610435c73ac81ac6aeee6a522","sha256:592a9268b5f90588945f519758ed53fad2e1e3b712294dd8af85dddb9eb04f72","sha256:67856fd669a1a58517b7eb8d8e1104c1e8edab33de476ba9854f3bc2b8dde28d","sha256:77e2f396487fa4938ab25988c7f37b38085daeee1898fb7d2a3b9a6d5f8f1b52","sha256:a2c053774931acc1259663ce6aba57fa9b078ff0c2fc2ae85a6237655e72a62b","sha256:daceaf45cfcc4ec964ecacf2e51c19d02b46e7acf58b93b47510ecf71b28e529","sha256:dcf8fed48b24ec2cc0d27e3260f364f1f7d1ee28bb90854dac9341a66239364b","sha256:f688daf59b8abd382f81678cc8919d75c43aa422777bfe6d49c6698b9898fa47"],"node_id":"asn_determinism","node_type":"strategy","status":"supported"},{"children":[],"claim":"Formal checkability holds through independent solver and prover backends: SMT (z3, cvc5), ASP (clingo), Datalog (souffle), model checking (TLA+ SANY, Alloy), and a Lean kernel proof.","evidence_artifact_ids":["sha256:194bd294be1058322c49e53309eaf17f56df2184f15503d9ac4150a7a8e0b7bb","sha256:3229752b8cb70aae5cf352dd2e666a902ae7fe5543c4366150b9c906323ed21a","sha256:4224e42851fe44127df938221d3b3ddb147b02e246962e5a7327a9c0a3e315f7","sha256:464892d106a2ec5b968a58260249fa08cddb03f610435c73ac81ac6aeee6a522","sha256:67856fd669a1a58517b7eb8d8e1104c1e8edab33de476ba9854f3bc2b8dde28d","sha256:77e2f396487fa4938ab25988c7f37b38085daeee1898fb7d2a3b9a6d5f8f1b52","sha256:a2c053774931acc1259663ce6aba57fa9b078ff0c2fc2ae85a6237655e72a62b","sha256:daceaf45cfcc4ec964ecacf2e51c19d02b46e7acf58b93b47510ecf71b28e529","sha256:dcf8fed48b24ec2cc0d27e3260f364f1f7d1ee28bb90854dac9341a66239364b","sha256:f688daf59b8abd382f81678cc8919d75c43aa422777bfe6d49c6698b9898fa47"],"node_id":"asn_formal_checkability","node_type":"strategy","status":"supported"}]